{
  "schema_version": "t024.set.consistency.v1",
  "batch_id": "batch-024-001",
  "set_id": "set-a",
  "representative_job_id": "job-005",
  "grouping_confidence": 0.94,
  "baseline": {
    "exposure_target_range": [
      -0.1,
      0.15
    ],
    "wb_delta_range": [
      -200,
      200
    ]
  },
  "item_results": [
    {
      "job_id": "job-001",
      "consistency_score": 91,
      "outlier": false
    },
    {
      "job_id": "job-010",
      "consistency_score": 62,
      "outlier": true,
      "outlier_reason": "different_lighting"
    }
  ],
  "overall_score": 88
}
